{
  "$schema": "https://vibe-mathing.local/schema/research-os-metadata-boundary.v1.json",
  "schema_version": "1.0.0",
  "metadata_kind": "working_set",
  "object_id": "research-os:template-working-set-v1",
  "claims_ceiling": "candidate_only",
  "non_authoritative": true,
  "non_mathematical_truth": true,
  "status": "candidate",
  "summary": "Synthetic template metadata fixture.",
  "bounded_reason": "Used only to exercise the public metadata boundary.",
  "labels": ["fixture", "candidate-only"],
  "coverage": {"kind": "not_applicable"},
  "refs": [
    {
      "ref": "problem:template-placeholder",
      "ref_kind": "problem",
      "trust": "managed",
      "observation": "observed"
    }
  ],
  "digests": [
    {
      "name": "fixture",
      "sha256": "0000000000000000000000000000000000000000000000000000000000000000"
    }
  ]
}
